{"$schema":"markata://schemas/content-index/v2","schema":"markata.content-index","schema_version":2,"scope":"public-metadata","generator":{"name":"markata-go","version":"fixture"},"source":{},"document_count":2,"documents":[{"path":"pages/review.md","slug":"review","href":"/review/","published":false,"draft":false,"private":false},{"path":"posts/private.md","slug":"private","href":"/private/","title":"Private title","title_text":"Private title","date":"2026-08-15T12:00:00Z","published":true,"draft":false,"private":true,"tags":["journal"],"description":"Safe summary","feeds":["private-archive"],"aliases":["old-private"],"avatar":"https://example.test/avatar.webp","authors":["waylon"],"categories":["notes"]}]}
